title,description,image,Source,category,text_cleaned
Chicago Botanic Garden Gift Shop,"Unique finds to delight gardeners, cooks, hosts, or personal-care enthusiasts of all ages. Collections include unique jewelry, along with the Garden’s custom collect...","https://assets.simpleviewinc.com/simpleview/image/upload/c_fit,w_225,h_225/crm/cnscvb/CBG_D91A1133-5056-A348-3A7CE9545E123089-d91a10055056a34_d91a11c3-5056-a348-3a94a6e6877c99af.jpg",Chicago North shore,Shopping,unique find delight gardener cook host personal care enthusiast age collection include unique jewelry along garden custom collect
Children's Gift Shop,"Carrying the classic favorites as well as the new and unusual in toys, books, science, outdoor, arts, puzzles, games, travel, personalized gifts and more for infants...","https://assets.simpleviewinc.com/simpleview/image/upload/c_fit,w_225,h_225/crm/cnscvb/Children_33CB0812-5056-A348-3A303C02D99BA146-33cb07505056a34_33cb086e-5056-a348-3acddc7b85ebfa73.jpg",Chicago North shore,Shopping,carrying classic favorite well new unusual toy book science outdoor art puzzle game travel personalized gift infant
Commonwealth Running,"With a mission to expand the sport of running through our local community, Commonwealth Running Company has knocked down perceived barriers for new runners who want ...","https://assets.simpleviewinc.com/simpleview/image/upload/c_fit,w_225,h_225/crm/cnscvb/Common_D1F1C60D-5056-A348-3AA99B20752E519F-d1f1c52c5056a34_d1f1c65d-5056-a348-3af9b3cb1ff38f72.jpg",Chicago North shore,Shopping,mission expand sport running local community commonwealth running company knocked perceived barrier new runner want
Convito Cafe & Market,"Gourmet Food & Wine Market offers an in-depth selection of prepared foods, with some focus on Italian fare, as well as other dishes from around the world. We have fr...","https://assets.simpleviewinc.com/simpleview/image/upload/c_fit,w_225,h_225/crm/cnscvb/Convito-Market_10D808ED-5056-BF65-D646E028436FCC49-10d806f75056bf6_10d8122c-5056-bf65-d691ef8f19ef82c0.jpg",Chicago North shore,Shopping,gourmet food wine market offer depth selection prepared food focus italian fare well dish around world fr
Cultivate Urban Rainforest & Gallery,"Cultivate is a lush urban rainforest and gathering place. Offering an art gallery featuring the work of world renowned as well as local artists, exotic plants labele...","https://assets.simpleviewinc.com/simpleview/image/upload/c_fit,w_225,h_225/crm/cnscvb/cultivate_A1C4F455-5056-BF65-D614335B8C668D9E-a1c4f2595056bf6_a1c4ff58-5056-bf65-d67a18759692a5ef.jpg",Chicago North shore,Shopping,cultivate lush urban rainforest gathering place offering art gallery featuring work world renowned well local artist exotic plant labele
Dave's Down to Earth Rock Shop,"A shop and a pre-historic life museum showcasing one of the largest private rock collections on display in United States. Selling authentic fossils, colored minerals...","https://assets.simpleviewinc.com/simpleview/image/upload/c_fit,w_225,h_225/crm/cnscvb/DavesRockShop_A2002EB5-5056-BF65-D6FAED74344FF7DE-a2002c925056bf6_a2003835-5056-bf65-d6e147a3fa16de3c.jpg",Chicago North shore,Shopping,shop pre historic life museum showcasing one largest private rock collection display united state selling authentic fossil colored mineral
Edward's Florist,Taking pride in using high-quality flowers that are in season for arrangements that are as stunningly unique as they are beautiful. Choose an artful arrangement from...,"https://assets.simpleviewinc.com/simpleview/image/upload/c_fit,w_225,h_225/crm/cnscvb/Edwards-Florist_053A0329-5056-A348-3AFE3C7D330EED44-053a023f5056a34_053a037f-5056-a348-3a6bb1354714d0c7.jpg",Chicago North shore,Shopping,taking pride using high quality flower season arrangement stunningly unique beautiful choose artful arrangement
Enaz for Life,A women's contemporary boutique located in the heart of Northfield. This mother/daughter store caters to women “on the go” varying in every shape and size! Stocking ...,"https://assets.simpleviewinc.com/simpleview/image/upload/c_fit,w_225,h_225/crm/cnscvb/Enaz_31E36102-5056-A348-3AB14859DFF7EBA1-31e3605f5056a34_31e36154-5056-a348-3a03c75aa136764e.jpg",Chicago North shore,Shopping,woman 's contemporary boutique located heart northfield mother daughter store caters woman “ go varying every shape size stocking
Erik's Bike & Board,"A premier bike, snowboard and ski store retailer for all of your bike, snowboard, downhill ski, bike repair and bike fitting needs. Road, mountain, electric, kids, ...","https://assets.simpleviewinc.com/simpleview/image/upload/c_fit,w_225,h_225/crm/cnscvb/Erik_D010C384-5056-A348-3A4546ABAC28F632-d010c2d95056a34_d010c3dc-5056-a348-3ac09d57f993f5f3.jpg",Chicago North shore,Shopping,premier bike snowboard ski store retailer bike snowboard downhill ski bike repair bike fitting need road mountain electric kid
Evanston Made,"A community arts organization with a mission to increase awareness and engagement with Evanston Artists through events, programming, pop-ups, and a robust online pre...","https://assets.simpleviewinc.com/simpleview/image/upload/c_fit,w_225,h_225/crm/cnscvb/EvanstonMade_A230314E-5056-BF65-D69F6901DA1BA352-a2302ef15056bf6_a2303b29-5056-bf65-d6979ca49bcc3111.jpg",Chicago North shore,Shopping,community art organization mission increase awareness engagement evanston artist event programming pop ups robust online pre
Eve Alfille Gallery and Studio,This award-winning artist and former archaeologist designs exquisite jewelry. The gallery is a frequent stop for jewelry lovers and now features an online store wher...,"https://assets.simpleviewinc.com/simpleview/image/upload/c_fit,w_225,h_225/crm/cnscvb/EveAfille_0DE48963-5056-BF65-D626BAC5E65240D0-0de488645056bf6_0de4913a-5056-bf65-d690e83d57b309b8.jpg",Chicago North shore,Shopping,award winning artist former archaeologist design exquisite jewelry gallery frequent stop jewelry lover feature online store wher
Few Spirits,"Evanston's first and only distillery, Few Spirits has been crafting award-winning whiskeys and gins since 2011. Express delivery, no hassle shipping or you can just ...","https://assets.simpleviewinc.com/simpleview/image/upload/c_fit,w_225,h_225/crm/cnscvb/Few_0B31EF5D-5056-A348-3A7606FC9226673E-0b31eec95056a34_0b31eff5-5056-a348-3ad03a5961e6f687.jpg",Chicago North shore,Shopping,evanston 's first distillery spirit crafting award winning whiskey gin since express delivery hassle shipping
Follow Your Nose,"Celebrating 20 years in Evanston! Natural and organic pet foods, treats, accessories and hand-made baked goods, including cupcakes and birthday cakes for your dog! B...","https://assets.simpleviewinc.com/simpleview/image/upload/c_fit,w_225,h_225/crm/cnscvb/FollowYourNose0-1e50ea085056a34_1e50eb26-5056-a348-3a146a5dbcbaa826.jpg",Chicago North shore,Shopping,celebrating year evanston natural organic pet food treat accessory hand made baked good including cupcake birthday cake dog b
Gearhead Outfitters,Equip yourself with what you need to enjoy all that the great outdoors has to offer! shop with Gearhead Outfitters for all your outdoor apparel and gear needs....,"https://assets.simpleviewinc.com/simpleview/image/upload/c_fit,w_225,h_225/crm/cnscvb/Uncle_3A67716F-5056-A348-3A2D1E204818543B-3a6770905056a34_3a6771d5-5056-a348-3af0902ce3db4830.jpg",Chicago North shore,Shopping,equip need enjoy great outdoors offer shop gearhead outfitter outdoor apparel gear need
The Glen Town Center,"This well-planned development offers beautiful shops and restaurant-lined streets reminiscent of a European town. A 10 screen ArcLight movie theatre complex, shops i...","https://assets.simpleviewinc.com/simpleview/image/upload/c_fit,w_225,h_225/crm/cnscvb/Glenview_The_Glen_Town_Center_10_a966eb7e-5056-a348-3ab1db6b66f19bbd.png",Chicago North shore,Shopping,well planned development offer beautiful shop restaurant lined street reminiscent european town screen arclight movie theatre complex shop
Glenview Coin & Collectibles,"Located in historic downtown Glenview since 1984, this family owned business buys and sells coins, jewelry, and other collectibles. Their expertise combined with tru...","https://assets.simpleviewinc.com/simpleview/image/upload/c_fit,w_225,h_225/crm/cnscvb/Glenview-Coin_9E41CE08-5056-A348-3A37E3B7299CB96A-9e41cd1b5056a34_9e41ce89-5056-a348-3a38323de698498e.jpg",Chicago North shore,Shopping,located historic downtown glenview since family owned business buy sell coin jewelry collectible expertise combined tru
Good Grapes,"A North Shore gem with a finely curated wine selection, artisanal charcuterie, select craft beers, and canned cocktails in a neighborhood store. Private and public w...","https://assets.simpleviewinc.com/simpleview/image/upload/c_fit,w_225,h_225/crm/cnscvb/GoodGrapes_48B232A4-5056-BF65-D64C9C81F8A84809-48b2318e5056bf6_48b2373d-5056-bf65-d6b505d227506eb6.jpg",Chicago North shore,Shopping,north shore gem finely curated wine selection artisanal charcuterie select craft beer canned cocktail neighborhood store private public w
Green Bay Cycles,"A fun, friendly, family-oriented bike shop offering experience, professionalism and level of expertise usually reserved for pro shops. Focusing on your needs, you'll...","https://assets.simpleviewinc.com/simpleview/image/upload/c_fit,w_225,h_225/crm/cnscvb/GreenBayCycles_04123E79-5056-A348-3AD25E1E3FAAA3EC-04123d8c5056a34_04123ef4-5056-a348-3aa0e0df6adebdf8.jpg",Chicago North shore,Shopping,fun friendly family oriented bike shop offering experience professionalism level expertise usually reserved pro shop focusing need 'll
Heritage Trail Mercantile,"This is a treasure hunt of a store! A wide, open “loft-like” space that is home to 42 of Chicagoland’s finest Antique & Vintage Vendors....","https://assets.simpleviewinc.com/simpleview/image/upload/c_fit,w_225,h_225/crm/cnscvb/HerTrailFB_D35175C6-5056-A348-3A4C3D591C146F19-d35174ee5056a34_d3517631-5056-a348-3af4262dc188a97c.jpg",Chicago North shore,Shopping,treasure hunt store wide open “ loft like space home chicagoland finest antique vintage vendor
Historic Wagner Farm Gift Store,"While you’re visiting Historic Wagner Farm, stop by the Museum Store, located in the Heritage Center and pick up a nostalgic souvenir of your visit to Historic Wagne...","https://assets.simpleviewinc.com/simpleview/image/upload/c_fit,w_225,h_225/crm/cnscvb/Wagner_0ACAF3B7-5056-A348-3AD9E300D14FC70C-0acaf2f85056a34_0acaf410-5056-a348-3afb34de5a908898.jpg",Chicago North shore,Shopping,visiting historic wagner farm stop museum store located heritage center pick nostalgic souvenir visit historic wagne
Hubba-Hubba,"Fixture for trendy women's clothes, new accessories, and occasional events. Your favorites, your must-haves, and your go-to pieces that you can count on to always en...","https://assets.simpleviewinc.com/simpleview/image/upload/c_fit,w_225,h_225/crm/cnscvb/HubbaHubba_0DF8CD41-5056-BF65-D6920D803C7C8F76-0df8cc235056bf6_0df8d5eb-5056-bf65-d6430ff3973df5f2.jpg",Chicago North shore,Shopping,fixture trendy woman 's clothes new accessory occasional event favorite must have go piece count always en
Hudson Grace,Hudson Grace started as the dream of co-founders Monelle Totah and Gary McNatton and was born out of their shared passion for gifting and entertaining. Their style i...,"https://assets.simpleviewinc.com/simpleview/image/upload/c_fit,w_225,h_225/crm/cnscvb/HudsonGrace_20783F47-5056-A348-3AF2397C932DA2EA-20783e9e5056a34_20783faf-5056-a348-3a8e8485519fbd83.jpg",Chicago North shore,Shopping,hudson grace started dream co founder monelle totah gary mcnatton born shared passion gifting entertaining style
Illinois Holocaust Museum,"Shop a wide assortment of Judaica, jewelry, fair trade, books and DVDs, special exhibit merchandise including Ruth Bader Ginsburg items....","https://assets.simpleviewinc.com/simpleview/image/upload/c_fit,w_225,h_225/crm/cnscvb/IHMEC_D8F33648-5056-A348-3AD6114DC20CA494-d8f335815056a34_d8f336b3-5056-a348-3a16fa051be8edd3.jpg",Chicago North shore,Shopping,shop wide assortment judaica jewelry fair trade book dvd special exhibit merchandise including ruth bader ginsburg item
Inspired Indian Cooking,"Offering easy and delicious cooking experiences with spice kits for iconic Indian dishes and live, virtual cooking classes. Shop in-person or on-line, they ship nati...","https://assets.simpleviewinc.com/simpleview/image/upload/c_fit,w_225,h_225/crm/cnscvb/InspiredIndian_A195C1B7-5056-BF65-D63D873D8303ECCC-a195c0065056bf6_a195cb01-5056-bf65-d6b2af11a5080235.jpg",Chicago North shore,Shopping,offering easy delicious cooking experience spice kit iconic indian dish live virtual cooking class shop person line ship nati
Junior League of Evanston-North Shore Thrift House,"Whether you’re a bargain-hunter, a student on a budget, or someone who likes to shop for treasures, you’ll find constantly changing merchandise of great finds at Thr...","https://assets.simpleviewinc.com/simpleview/image/upload/c_fit,w_225,h_225/crm/cnscvb/ThriftHouse_E373DD1C-9A38-14AE-AF479D1882A7644F-e373dba1d663368_e373e68c-f386-a4fd-a6ae9a24b5aa416a.jpg",Chicago North shore,Shopping,whether bargain hunter student budget someone like shop treasure find constantly changing merchandise great find thr
Kilwins,"Old-fashioned confectionery store selling chocolates, ice cream, handmade sweets & gift baskets....","https://assets.simpleviewinc.com/simpleview/image/upload/c_fit,w_225,h_225/crm/cnscvb/Kilwins0-0959d0fa5056a34_0959d29d-5056-a348-3a9738f879686b7e.jpg",Chicago North shore,Shopping,old fashioned confectionery store selling chocolate ice cream handmade sweet gift basket
Knightsbridge Wine Shoppe,A leader in the Chicagoland area for sought after wine and other rare offerings. Offers personal and knowledgeable service to navigate the broad selection. Happy to...,"https://assets.simpleviewinc.com/simpleview/image/upload/c_fit,w_225,h_225/crm/cnscvb/knightsbridge-Wine_9FA214FF-5056-A348-3A47E44DE61CF4EB-9fa214585056a34_9fa2156b-5056-a348-3ae50228f7f3552d.jpg",Chicago North shore,Shopping,leader chicagoland area sought wine rare offering offer personal knowledgeable service navigate broad selection happy
Lincolnwood Town Center,The Lincolnwood Town Center is a beautifully designed and fully enclosed mall that features bright lights and marble floors for a comfortable environment and friendl...,"https://assets.simpleviewinc.com/simpleview/image/upload/c_fit,w_225,h_225/crm/cnscvb/LincolnwoodTownCenter_1A882578-E3EA-15C7-1E0DFFFE1415DC8F-1a882397d4284e9_1a882dfd-e0db-53d2-a61c6c5d5ad76d1f.jpg",Chicago North shore,Shopping,lincolnwood town center beautifully designed fully enclosed mall feature bright light marble floor comfortable environment friendl
Lori's Designer Shoes,"A shoe lovers dream come true! This one-of-a-kind find is stocked with thousands of shoes, boots, bags, accessories, and apparel. Hundreds of high-end women's shoe s...","https://assets.simpleviewinc.com/simpleview/image/upload/c_fit,w_225,h_225/crm/cnscvb/Lori_31B5ECA9-5056-A348-3ACFB9E47D7EA30C-31b5ebb45056a34_31b5ed17-5056-a348-3a30039e574de01b.jpg",Chicago North shore,Shopping,shoe lover dream come true one kind find stocked thousand shoe boot bag accessory apparel hundred high end woman 's shoe
Macushla Brewing Co.,"Local family-owned brewery produces a wide range of beers. From lagers, blondes, IPAs and stouts, there is something for everyone. Dedicated to good atmosphere and g...","https://assets.simpleviewinc.com/simpleview/image/upload/c_fit,w_225,h_225/crm/cnscvb/Machushla-1_409225C0-5056-A348-3A8615AF31E8914D-409225085056a34_4092263e-5056-a348-3a13111bb5ec8e6f.jpg",Chicago North shore,Shopping,local family owned brewery produce wide range beer lager blonde ipas stout something everyone dedicated good atmosphere g
Madison Grace,"Located in Downtown Evanston, Madison Grace helps women of all ages look and feel their best. A shopping destination for women’s contemporary fashion with a chic and...","https://assets.simpleviewinc.com/simpleview/image/upload/c_fit,w_225,h_225/crm/cnscvb/MadisonGrace2_2074B27A-5056-A348-3A6FC09E18AAFF12-2074b1f25056a34_2074b2d5-5056-a348-3a26d7ea3b84f375.jpg",Chicago North shore,Shopping,located downtown evanston madison grace help woman age look feel best shopping destination woman contemporary fashion chic
Material Possessions,"Specializing in thought-provoking pieces designed to ignite the imagination, stir the soul and make a statement are aplenty here. There are articles of whimsy too. ...","https://assets.simpleviewinc.com/simpleview/image/upload/c_fit,w_225,h_225/crm/cnscvb/MaterialPosessions_0E0D9F77-5056-BF65-D69987B7C6976079-0e0d9cf25056bf6_0e0da90c-5056-bf65-d6e2f464eef16ded.jpg",Chicago North shore,Shopping,specializing thought provoking piece designed ignite imagination stir soul make statement aplenty article whimsy
Mattie M.,"This North Shore clothing boutique offers many upscale choices in designer sportswear, dresses and accessories. Looks range from contemporary to classic allowing you...","https://assets.simpleviewinc.com/simpleview/image/upload/c_fit,w_225,h_225/crm/cnscvb/MattieM_0E16BE80-5056-BF65-D60FEFD3B4491A5B-0e16bd055056bf6_0e16c85b-5056-bf65-d6d6ccadde287dde.jpg",Chicago North shore,Shopping,north shore clothing boutique offer many upscale choice designer sportswear dress accessory look range contemporary classic allowing
Maya Papaya & Tony Macarony,"A fun Evanston children's boutique, sharing cool clothes and gifts for kids 0 to 12. You’ll find pretty girl’s dresses, boys and girls coats, shoes and loungewear, ...","https://assets.simpleviewinc.com/simpleview/image/upload/c_fit,w_225,h_225/crm/cnscvb/Evanston_Maya_Papaya_and_Tony_Macarony0_a960814d-5056-a348-3ab7e90027f261b6.png",Chicago North shore,Shopping,fun evanston child 's boutique sharing cool clothes gift kid find pretty girl dress boy girl coat shoe loungewear
Maze Home,A natural extension of owner Cindy Galvin’s interior design business – Bardes Interiors – the store provides a loft-like environment for sharing her exte...,"https://assets.simpleviewinc.com/simpleview/image/upload/c_fit,w_225,h_225/crm/cnscvb/Winnetka_Maze_Home1_a961426e-5056-a348-3acb50729feff3e5.png",Chicago North shore,Shopping,natural extension owner cindy galvin interior design business bardes interior store provides loft like environment sharing exte
Morning Glory Flower Shop,"A full service, every occasion florist. Creating beautiful fresh flower arrangements as well as blooming plants and European gardens....","https://assets.simpleviewinc.com/simpleview/image/upload/c_fit,w_225,h_225/crm/cnscvb/Glenview_Morning_Glory_Flower_Shop0_a9611944-5056-a348-3aa0b8d46a168422.png",Chicago North shore,Shopping,full service every occasion florist creating beautiful fresh flower arrangement well blooming plant european garden
NiceLena & Friends,"Check out this creative, bold store selling a wide range of gifts and collectibles. You will find mugs, candles, prints, stickers, do-it-yourself kits, and a wide se...","https://assets.simpleviewinc.com/simpleview/image/upload/c_fit,w_225,h_225/crm/cnscvb/NiceLena_3766A5D0-5056-A348-3A86CD9A505EE3BA-3766a4445056a34_3766a63e-5056-a348-3aa044e967ad9c30.jpg",Chicago North shore,Shopping,check creative bold store selling wide range gift collectible find mug candle print sticker kit wide se
Nordstrom,"An unerring eye for what's next in fashion. A relentless drive to exceed expectations. For more than 100 years, Nordstrom has worked to deliver the best possible sho...","https://assets.simpleviewinc.com/simpleview/image/upload/c_fit,w_225,h_225/crm/cnscvb/Skokie_Nordstrom0_a95fd164-5056-a348-3ad5aabf73e0f3bc.png",Chicago North shore,Shopping,unerring eye 's next fashion relentless drive exceed expectation year nordstrom worked deliver best possible sho
North Shore Exchange Glencoe,Award-winning luxury charitable resale shop for women and the home. North Shore Exchange donates 100% of its profits to charity and has made $3.7 million in donation...,"https://assets.simpleviewinc.com/simpleview/image/upload/c_fit,w_225,h_225/crm/cnscvb/NSEchange2_EE649D43-5056-BF65-D6F2A67B74ACAEE0-ee649c8a5056bf6_ee64abbf-5056-bf65-d6d792b906620221.jpg",Chicago North shore,Shopping,award winning luxury charitable resale shop woman home north shore exchange donates profit charity made million donation
Northbrook Court,"Shop the brands you love at the only indoor shopping center on the North Shore. Featuring shopping, dining, and an AMC movie theater complex. Located in the heart of...","https://assets.simpleviewinc.com/simpleview/image/upload/c_fit,w_225,h_225/crm/cnscvb/NBCourt0-2a06e65c5056a34_2a06e86a-5056-a348-3a8e85aeeea14c92.jpg",Chicago North shore,Shopping,shop brand love indoor shopping center north shore featuring shopping dining amc movie theater complex located heart
Notice Accessories for Living,"Notice is a constantly changing selection of comfy, cute clothing and accessories with a touch of quirk. The shop also includes a carefully curated collection of bab...","https://assets.simpleviewinc.com/simpleview/image/upload/c_fit,w_225,h_225/crm/cnscvb/Evanston_Notice0_a92df3ab-5056-a348-3a3c4bba7f0779d6.png",Chicago North shore,Shopping,notice constantly changing selection comfy cute clothing accessory touch quirk shop also includes carefully curated collection bab
Peachtree Place,"A Northfield treasure, specializing in wonderful gifts and home accessories. The store has grown from its original two rooms to eleven rooms filled with lamps, pri...","https://assets.simpleviewinc.com/simpleview/image/upload/c_fit,w_225,h_225/crm/cnscvb/Peachtree_32A9C34C-5056-A348-3A0D7DFF6E2C215B-32a9c2765056a34_32a9c3b8-5056-a348-3a57a9038a187010.jpg",Chicago North shore,Shopping,northfield treasure specializing wonderful gift home accessory store grown original two room eleven room filled lamp pri
Peckish Pig,"Evanston’s first brewery! Your source for craft beer, specialty cocktails to-go at this brewpub on the edge of where Chicago meets Evanston. Peckish Pig typically ha...","https://assets.simpleviewinc.com/simpleview/image/upload/c_fit,w_225,h_225/crm/cnscvb/PeckishPig0_a92ab39f-5056-a348-3a22fc0b96c01278.png",Chicago North shore,Shopping,evanston first brewery source craft beer specialty cocktail go brewpub edge chicago meet evanston peckish pig typically ha
Penzeys Spices,"A cook’s dream come true in this spice store where you will find a vast selection of Penzeys brand spices, trial bags, gift boxes, gadgets bottles and more....","https://assets.simpleviewinc.com/simpleview/image/upload/c_fit,w_225,h_225/crm/cnscvb/Penzeys_D2C8D894-5056-A348-3ABAD4E148F55C82-d2c8d7945056a34_d2c8d903-5056-a348-3ab7930908a34f55.jpg",Chicago North shore,Shopping,cook dream come true spice store find vast selection penzeys brand spice trial bag gift box gadget bottle
Plaza del Lago,"A robust mix of on-trend and classic retailers, one-of-a-kind boutiques, distinctive restaurants, grocery, and services all beautifully bundled in a Spanish-style co...","https://assets.simpleviewinc.com/simpleview/image/upload/c_fit,w_225,h_225/crm/cnscvb/PlazaDelLago_5C428762-5056-BF65-D61C2DF4C454B7E6-5c4285795056bf6_5c429165-5056-bf65-d65b1e7ec3138b63.jpg",Chicago North shore,Shopping,robust mix trend classic retailer one kind boutique distinctive restaurant grocery service beautifully bundled spanish style co
Randoons,"A hip clothing, accessory and gift boutique bringing city style to the 'burbs. A couture cafe inspired by all things sweet and funky. We carry many small artist line...","https://assets.simpleviewinc.com/simpleview/image/upload/c_fit,w_225,h_225/crm/cnscvb/Randoons_0E58234A-5056-BF65-D66B39A6E9F3FF8E-0e5821785056bf6_0e582cc1-5056-bf65-d66cac2fcef6b81c.jpg",Chicago North shore,Shopping,hip clothing accessory gift boutique bringing city style 'burbs couture cafe inspired thing sweet funky carry many small artist line
REI,"Life outdoors is a life well-lived. REI knows firsthand the importance of quality outdoor gear, and stand behind all of their products with a 100% lifetime satisfact...","https://assets.simpleviewinc.com/simpleview/image/upload/c_fit,w_225,h_225/crm/cnscvb/REI_A0583F70-5056-A348-3A1D23D9CACA6842-a0583ef05056a34_a0583fc4-5056-a348-3ac83e7494b7a960.jpg",Chicago North shore,Shopping,life outdoors life well lived rei know firsthand importance quality outdoor gear stand behind product lifetime satisfact
Saville Flowers & Gifts,"A forth-generation family owned business, serving the North Shore and beyond. From everyday wrapped bouquets to large scale events and weddings, Saville Flowers prov...","https://assets.simpleviewinc.com/simpleview/image/upload/c_fit,w_225,h_225/crm/cnscvb/SavilleFlowers0-ec5061675056a34_ec5062ed-5056-a348-3ae82cecde7e0dc8.jpg",Chicago North shore,Shopping,forth generation family owned business serving north shore beyond everyday wrapped bouquet large scale event wedding saville flower prov
Secret Treasures,Most of the items date from the 1920s to 1950s and you might even find a 1950s Radio Flyer Wagon or an original 1940s military issued Hamilton watch. It’s always an ...,"https://assets.simpleviewinc.com/simpleview/image/upload/c_fit,w_225,h_225/crm/cnscvb/SecretTreasures_0E649C51-5056-BF65-D6276187654ADB11-0e649a755056bf6_0e64a603-5056-bf65-d66a19988457b678.jpg",Chicago North shore,Shopping,item date might even find radio flyer wagon original military issued hamilton watch always
