title,description,image,Source,category,text_cleaned
Route History Museum & Souvenir Shop,"At Route History visitors can experience and learn about pioneers that made significant contributions to Illinois, the city of Springfield, the  greater society, located along…",https://enjoyillinois.dottie.io/assets/Tourism-Operators/images/Lathan-1__FocusFillWyIwLjAwIiwiMC4wMCIsMzg0LDQ2NF0.JPG,Enjoy Illinois,"History, Art & Culture Tours",route history visitor experience learn pioneer made significant contribution illinois city springfield greater society located along…
Underground Railroad Shuttle Tours,"Discover the story of the Underground Railroad throughout Alton, IL.",https://enjoyillinois.dottie.io/assets/Tourism-Operators/images/Lovejoy-Grave-with-Eric-Robinson__FocusFillWyIwLjAwIiwiMC4wMCIsMzg0LDQ2NF0.jpg,Enjoy Illinois,"History, Art & Culture Tours",discover story underground railroad throughout alton il
Jacksonville's Underground Railroad Tour,See a variety of locations in Jacksonville that have connection to the Underground Railroad.,https://enjoyillinois.dottie.io/assets/Tourism-Operators/images/IMG-671__FocusFillWyIwLjAwIiwiMC4wMCIsMzg0LDQ2NF0.JPG,Enjoy Illinois,"History, Art & Culture Tours",see variety location jacksonville connection underground railroad
Venue 5126,"Venue 5126 is an elegant, rustic country barn venue, perfect for your upcoming wedding and reception!",https://enjoyillinois.dottie.io/assets/Tourism-Operators/images/EmersonCreekTeatoom-plate__FocusFillWyIwLjAwIiwiMC4wMCIsMzg0LDQ2NF0.jpg,Enjoy Illinois,"History, Art & Culture Tours",venue elegant rustic country barn venue perfect upcoming wedding reception
Galena Trolley Tours,Enjoy beautiful views as well as wonderful photo opportunities. Galena Trolley Tours has historically and architecturally narrated tours.  By far the most affordable trolley tours…,https://enjoyillinois.dottie.io/assets/Tourism-Operators/images/Galena-Trolley-Tours101-Large3__FocusFillWyIwLjAwIiwiMC4wMCIsMzg0LDQ2NF0.jpg,Enjoy Illinois,"History, Art & Culture Tours",enjoy beautiful view well wonderful photo opportunity galena trolley tour historically architecturally narrated tour far affordable trolley tours…
Beall Mansion Historic Tours,Take an exquisitely elegant tour of an early 20th-century mansion full of ornate rooms featuring antique furnishings,https://enjoyillinois.dottie.io/assets/Tourism-Operators/images/Beall-Mansion-Historic-Tours__FocusFillWyIwLjAwIiwiMC4wMCIsMzg0LDQ2NF0.jpg,Enjoy Illinois,"History, Art & Culture Tours",take exquisitely elegant tour early th century mansion full ornate room featuring antique furnishing
Bicentennial Plaza,"To mark Illinois' 200th birthday, the Bicentennial Plaza was developed in 2018 to create a walkway linking the Lincoln Home to the Governor's Mansion and State…",https://enjoyillinois.dottie.io/assets/Tourism-Operators/images/Bicentenial-Plaza__FocusFillWyIwLjAwIiwiMC4wMCIsMzg0LDQ2NF0.jpg,Enjoy Illinois,"History, Art & Culture Tours",mark illinois ' th birthday bicentennial plaza developed create walkway linking lincoln home governor 's mansion state…
Downtown Elgin Public Arts Tour,Take a walking tour through scenic downtown Elgin to see various pieces of art in mediums like sculpture and mural paintings. Many can be seen while…,https://enjoyillinois.dottie.io/assets/Tourism-Operators/images/Enjoy-Illinois-Photo__FocusFillWyIwLjAwIiwiMC4wMCIsMzg0LDQ2NF0.jpg,Enjoy Illinois,"History, Art & Culture Tours",take walking tour scenic downtown elgin see various piece art medium like sculpture mural painting many seen while…
Amboy Depot Museum,The Amboy Depot Museum is located in a former depot built in 1876 which served as the division headquarters of the Illinois Central Railroad located in…,https://enjoyillinois.dottie.io/assets/Tourism-Operators/images/Depot-Museum__FocusFillWyIwLjAwIiwiMC4wMCIsMzg0LDQ2NF0.jpg,Enjoy Illinois,"History, Art & Culture Tours",amboy depot museum located former depot built served division headquarters illinois central railroad located in…
Franklin Creek Grist Mill & Interpretive Center,"The Franklin Creek Grist Mill and Interpretive Center is a reconstructed, timber frame, four-story 1847 grist mill located within the Franklin Creek State Natural Area.",https://enjoyillinois.dottie.io/assets/Tourism-Operators/images/Franklin-Creek-Grist-Mill-main-sign__FocusFillWyIwLjAwIiwiMC4wMCIsMzg0LDQ2NF0.jpg,Enjoy Illinois,"History, Art & Culture Tours",franklin creek grist mill interpretive center reconstructed timber frame four story grist mill located within franklin creek state natural area
Shawnee Shuttle,A professional wine trail tour service offering private mini-van tours of southern Illinois for small groups of two to six adults.,https://enjoyillinois.dottie.io/assets/Tourism-Operators/images/wine-tasting-hi-res__FocusFillWyIwLjAwIiwiMC4wMCIsMzg0LDQ2NF0.jpg,Enjoy Illinois,"History, Art & Culture Tours",professional wine trail tour service offering private mini van tour southern illinois small group two six adult
Carl Sandburg State Historic Site,"Author-poet Carl Sandburg was born in the the three-room cottage at 331 E. Third Street in Galesburg on January 6, 1878.",https://enjoyillinois.dottie.io/assets/Tourism-Operators/images/SandburgBirthplace2__FocusFillWyIwLjAwIiwiMC4wMCIsMzg0LDQ2NF0.JPG,Enjoy Illinois,"History, Art & Culture Tours",author poet carl sandburg born three room cottage e third street galesburg january
Elgin Historic District,Let history envelope you through architectural buildings,https://enjoyillinois.dottie.io/assets/Tourism-Operators/images/Good-HT__FocusFillWyIwLjAwIiwiMC4wMCIsMzg0LDQ2NF0.JPG,Enjoy Illinois,"History, Art & Culture Tours",let history envelope architectural building
Historic Downtown Long Grove,"As Illinois’ oldest historic district, Long Grove is a quaint place to breathe easy, where historic architecture and colorful storefronts give way to a unique variety…",https://enjoyillinois.dottie.io/assets/Tourism-Operators/images/LongGroveTOMs__FocusFillWyIwLjAwIiwiMC4wMCIsMzg0LDQ2NF0.jpg,Enjoy Illinois,"History, Art & Culture Tours",illinois oldest historic district long grove quaint place breathe easy historic architecture colorful storefront give way unique variety…
