title,description,image,Source,category,text_cleaned
Sketchbook Brewing Company,"Craft beer lovers rejoice! Sketchbook Brewing Co., founded six years ago in Evanston, has opened a taproom in Skokie! Grab your howlers, growlers or a 6 pack to go o...","https://assets.simpleviewinc.com/simpleview/image/upload/c_fit,w_225,h_225/crm/cnscvb/Sketchbook_0AEF8B2D-5056-A348-3ADA622EA20FD7FE-0aef8a745056a34_0aef8b85-5056-a348-3a63c821087e6008.jpg",Chicago North shore,Shopping,craft beer lover rejoice sketchbook brewing co founded six year ago evanston opened taproom skokie grab howler growler pack go
Spice House,"Family owned since 1957, these merchants offer the highest quality, hand-selected and hand-prepared spices and herbs at far below grocery store prices. Featuring han...","https://assets.simpleviewinc.com/simpleview/image/upload/c_fit,w_225,h_225/crm/cnscvb/Evanston_Spice_House0_a9578262-5056-a348-3a906e05bfd3f003.png",Chicago North shore,Shopping,family owned since merchant offer highest quality hand selected hand prepared spice herb far grocery store price featuring han
Squeezebox Books and Music,"A boutique style, thematically based used book and music store, browsable and ever changing, Squeezebox carries all shapes, sizes and curious categories of books and...","https://assets.simpleviewinc.com/simpleview/image/upload/c_fit,w_225,h_225/crm/cnscvb/Evanston_Squeezebox_Books_and_Music0_a954f691-5056-a348-3a3ba929566c545d.png",Chicago North shore,Shopping,boutique style thematically based used book music store browsable ever changing squeezebox carry shape size curious category book
Starved Rock Cabinets,"It all starts with wood, of course—and all of our wood is responsibly and sustainably sourced. It ends with custom cabinetry that meets your needs and your tastes. O...","https://assets.simpleviewinc.com/simpleview/image/upload/c_fit,w_225,h_225/crm/cnscvb/StarvedRockCabinets_D82875B2-5056-BF65-D6E4558520533193-d82874f95056bf6_d828895b-5056-bf65-d66bd3f03faee83d.jpg",Chicago North shore,Shopping,start wood course wood responsibly sustainably sourced end custom cabinetry meet need taste
Stella,"A chic and funky boutique filled with one-of-a-kind treasures where you slowly browse around in a warm, relaxing atmosphere. Situated on lively Central Street in Eva...","https://assets.simpleviewinc.com/simpleview/image/upload/c_fit,w_225,h_225/crm/cnscvb/Evanston_Stella0_a954e0c6-5056-a348-3a12668865df1c46.png",Chicago North shore,Shopping,chic funky boutique filled one kind treasure slowly browse around warm relaxing atmosphere situated lively central street eva
Swantiques,"Swantiques offers an ever-changing selection of vintage furniture, lighting, art, textiles, and decorative objects. Our offerings range from antique to post-modern, ...","https://assets.simpleviewinc.com/simpleview/image/upload/c_fit,w_225,h_225/crm/cnscvb/Swan_944128A9-5056-A348-3A77A846F868A1A0-944127695056a34_94412923-5056-a348-3af6a64435e02004.jpg",Chicago North shore,Shopping,swantiques offer ever changing selection vintage furniture lighting art textile decorative object offering range antique post modern
Temperance Beer Co.,"A hometown favorite,Temperance Beer Co., is a taproom pouring house beers, offering growlers to go. Great gift options for those that want to gift something with a l...","https://assets.simpleviewinc.com/simpleview/image/upload/c_fit,w_225,h_225/crm/cnscvb/Evanston_Temperance_Beer_Company1_a94b81fd-5056-a348-3a4673c61f41e8f0.png",Chicago North shore,Shopping,hometown favorite temperance beer co taproom pouring house beer offering growler go great gift option want gift something l
Ten Ninety Brewing Company,"Pick up that unique holiday gift for beer- loving friends, family or yourself. Stock up on your favorite craft beer. Cans and growlers to go. Call or order online at...","https://assets.simpleviewinc.com/simpleview/image/upload/c_fit,w_225,h_225/crm/cnscvb/TenNinety_0EB8C774-5056-BF65-D6915D20CC151C9B-0eb8c6135056bf6_0eb8d0b0-5056-bf65-d654b68465d06713.jpg",Chicago North shore,Shopping,pick unique holiday gift beer loving friend family stock favorite craft beer can growler go call order online
Ten Thousand Villages,This fair trade retail phenomenon was founded by visionary entrepreneur Edna Ruth Byler in 1946. It has grown into a global network of social entrepreneurs working ...,"https://assets.simpleviewinc.com/simpleview/image/upload/c_fit,w_225,h_225/crm/cnscvb/Evanston_Ten_Thousand_Villages0_a9682b3a-5056-a348-3a321f136aceb7d3.png",Chicago North shore,Shopping,fair trade retail phenomenon founded visionary entrepreneur edna ruth byler grown global network social entrepreneur working
The Alchemists Wife,"Handmade soaps, body care, home fragrance, natural cleaning supplies and laundry, candles, bespoke fragrances for men and women. Men's shaving, skin and body care, r...","https://assets.simpleviewinc.com/simpleview/image/upload/c_fit,w_225,h_225/crm/cnscvb/AlchemistsWife0-1e56f2b65056a34_1e56f421-5056-a348-3a113805110aa9ed.jpg",Chicago North shore,Shopping,handmade soap body care home fragrance natural cleaning supply laundry candle bespoke fragrance men woman men 's shaving skin body care r
The Flower Shop in Glencoe,"Unique boutique gift shop and floral studio with a love of all things pretty. Offering everyday, weekly, monthly florals, seasonal planting subscriptions, orchids, ...","https://assets.simpleviewinc.com/simpleview/image/upload/c_fit,w_225,h_225/crm/cnscvb/FlowerShop0-ec5a384c5056a34_ec5a3a2f-5056-a348-3a4960d20314df64.jpg",Chicago North shore,Shopping,unique boutique gift shop floral studio love thing pretty offering everyday weekly monthly florals seasonal planting subscription orchid
Twisted Trunk,"Unique consignment store, specializing in higher end pre-owned items. Also carry new items from various designers. Featuring anything from basic furniture to unique ...","https://assets.simpleviewinc.com/simpleview/image/upload/c_fit,w_225,h_225/crm/cnscvb/TwistedTrunk_0ED883F8-5056-BF65-D6AE3CE8ECB64754-0ed8829b5056bf6_0ed88ca7-5056-bf65-d697da08606c6472.jpg",Chicago North shore,Shopping,unique consignment store specializing higher end pre owned item also carry new item various designer featuring anything basic furniture unique
Valentina,"Women’s clothing, jewelry, accessories, gifts for the home. Valentina is a modern and contemporary, unique boutique....","https://assets.simpleviewinc.com/simpleview/image/upload/c_fit,w_225,h_225/crm/cnscvb/Valentina_FEA47A00-5056-A348-3A832F3691E549FC-fea479295056a34_fea47a51-5056-a348-3a77cbe7b2213e04.jpg",Chicago North shore,Shopping,woman clothing jewelry accessory gift home valentina modern contemporary unique boutique
The Village Treasure House,A non-profit consignment home store featuring upscale and vintage furniture and home décor. A convenient resource for those in need of selling or donating home furn...,"https://assets.simpleviewinc.com/simpleview/image/upload/c_fit,w_225,h_225/crm/cnscvb/village-treasure_A0058695-5056-A348-3ADE64398E93DAEB-a00585d65056a34_a00586e9-5056-a348-3a3007896d4eb641.jpg",Chicago North shore,Shopping,non profit consignment home store featuring upscale vintage furniture home décor convenient resource need selling donating home furn
Vogue Fabrics,"Enabling fabriholics since 1945, Vogue Fabrics is a mecca for sewing enthusiasts around the globe. Specializing in fashion fabrics, you will also find bridal, home d...","https://assets.simpleviewinc.com/simpleview/image/upload/c_fit,w_225,h_225/crm/cnscvb/Evanston_Vogue_Fabrics0_a9544111-5056-a348-3a9f6334a9d83dae.png",Chicago North shore,Shopping,enabling fabriholics since vogue fabric mecca sewing enthusiast around globe specializing fashion fabric also find bridal home
Westfield Old Orchard,"Westfield Old Orchard is Chicagoland’s premier shopping center and lifestyle destination. With an incredible wealth of over 150 retailers, dining options, and event ...","https://assets.simpleviewinc.com/simpleview/image/upload/c_fit,w_225,h_225/crm/cnscvb/Skokie_Westfield_Old_Orchard0_a969b681-5056-a348-3ad17e7beca6f531.png",Chicago North shore,Shopping,westfield old orchard chicagoland premier shopping center lifestyle destination incredible wealth retailer dining option event
Wheel and Sprocket,"A Top 100 bicycle shop serving all cyclists. Selling the top brands of bikes, parts, and accessories. Offering repair and maintenance of all brands and bicycle fitti...","https://assets.simpleviewinc.com/simpleview/image/upload/c_fit,w_225,h_225/crm/cnscvb/WheelSprokcet_0EFDF74B-5056-BF65-D61BB84D2A2C7F27-0efdf5fa5056bf6_0efdffe5-5056-bf65-d6504c82cbe3f836.jpg",Chicago North shore,Shopping,top bicycle shop serving cyclist selling top brand bike part accessory offering repair maintenance brand bicycle fitti
Wheeling Town Center,"With nearly a dozen restaurants, stores and CMX Movie Theatre, direct access to Metra, the Wheeling Town Center is the place to work and play!...","https://assets.simpleviewinc.com/simpleview/image/upload/c_fit,w_225,h_225/crm/cnscvb/WheelingTownCenter_831C0C87-5056-A348-3AC7A7DC9E079E26-831c0bf35056a34_831c0d06-5056-a348-3a5e69b4c59618d1.jpg",Chicago North shore,Shopping,nearly dozen restaurant store cmx movie theatre direct access metra wheeling town center place work play
Wild Child,"A family-owned specialty toy store for kids from infancy to 15 years old. Carrying unique toys, games, crafts, jewelry and apparel....","https://assets.simpleviewinc.com/simpleview/image/upload/c_fit,w_225,h_225/crm/cnscvb/WildChild_0F0D2435-5056-BF65-D6E921AD9AE10C1A-0f0d22e05056bf6_0f0d2e01-5056-bf65-d60f96bbe1f77826.jpg",Chicago North shore,Shopping,family owned specialty toy store kid infancy year old carrying unique toy game craft jewelry apparel
Wine Goddess,"A fresh, felicitous take on the grape and its noblest derivative: Wine! An Evanston-based wine bar and retailer of craft wine, beer, and spirits....","https://assets.simpleviewinc.com/simpleview/image/upload/c_fit,w_225,h_225/crm/cnscvb/WineGod_366F0526-5056-A348-3A2DCDD70AB5F3AE-366f03f45056a34_366f05a7-5056-a348-3a9aa086db5b6a3b.jpg",Chicago North shore,Shopping,fresh felicitous take grape noblest derivative wine evanston based wine bar retailer craft wine beer spirit
Ed Rudolph Northbrook Velodrome,"One of only a few official quarter-mile bike tracks in the country, this outdoor velodrome attracts top cyclists from the Midwest. There are weekly races in the summ...","https://assets.simpleviewinc.com/simpleview/image/upload/c_fit,w_225,h_225/crm/cnscvb/Northbrook_Ed_Rudolph_Northbrook_Velodrome0_a965c9ea-5056-a348-3a5b47bb6dca1d3e.png",Chicago North shore,Shopping,one official quarter mile bike track country outdoor velodrome attracts top cyclist midwest weekly race summ
Funtopia Adventure Park,"A large, active entertainment facility that combines sports and fun with numerous attractions such as indoor climbing walls, a rope course, a caving system, and more...","https://assets.simpleviewinc.com/simpleview/image/upload/c_fit,w_225,h_225/crm/cnscvb/Funtopia.jpg10-0b515a675056a34_0b515bba-5056-a348-3a3e301838137d6f.jpg",Chicago North shore,Shopping,large active entertainment facility combine sport fun numerous attraction indoor climbing wall rope course caving system
Heritage Park,"Heritage Park is a 100+ acre nature, recreation and community gathering place. Offering something for everyone including 10-acre Lake Heritage with breathtaking scen...","https://assets.simpleviewinc.com/simpleview/image/upload/c_fit,w_225,h_225/crm/cnscvb/Wheeling_Heritage_Park1_a940a223-5056-a348-3a6e0c65a9e379d6.png",Chicago North shore,Shopping,heritage park acre nature recreation community gathering place offering something everyone including acre lake heritage breathtaking scen
Midtown Lustbader Health Club,"A boutique Midtown club nestled within Bernard Weinger JCC in Northbrook, Marvin Lustbader Health Club features an indoor, 25-yard swimming pool, 7,000 sq. foot gymn...","https://assets.simpleviewinc.com/simpleview/image/upload/c_fit,w_225,h_225/crm/cnscvb/Midtown-Lustbader_fitness-4--b3bc20ae5056a34_b3bc227d-5056-a348-3afc7b53fa012670.jpg",Chicago North shore,Shopping,boutique midtown club nestled within bernard weinger jcc northbrook marvin lustbader health club feature indoor yard swimming pool sq foot gymn
North Shore Sports Center,"North Shore's top choice when planning impactful interaction. The 96,000 square foot Sports and Events Center combines state-of-the-art indoor fields, courts and ada...","https://assets.simpleviewinc.com/simpleview/image/upload/c_fit,w_225,h_225/crm/cnscvb/Northbrook_The_Accelerated_Center0_a9784fc7-5056-a348-3a6f14feaa881370.png",Chicago North shore,Shopping,north shore 's top choice planning impactful interaction square foot sport event center combine state art indoor field court ada
Northwestern University Wildcats,"The Northwestern Wildcats offer some of the best Division 1 college sports action in the Midwest, featuring 19 teams and competing in the Big Ten Conference....","https://assets.simpleviewinc.com/simpleview/image/upload/c_fit,w_225,h_225/crm/cnscvb/Evanston_Northwestern_University_Spectator_Sports0_a95e5d74-5056-a348-3ae3f0bedd5b1a0d.jpg",Chicago North shore,Shopping,northwestern wildcat offer best division college sport action midwest featuring team competing big ten conference
Skokie Sports Park,"Featuring one of the top 100 rated golf ranges in the U.S., complete with a two-tier, 40 station range with an automatic tee-up system. The driving range features a...","https://assets.simpleviewinc.com/simpleview/image/upload/c_fit,w_225,h_225/crm/cnscvb/Skokie_Skokie_Sports_Park0_a95741c6-5056-a348-3a649ad27a049771.png",Chicago North shore,Shopping,featuring one top rated golf range u complete two tier station range automatic tee system driving range feature
Ultimate Ninjas North Shore,"Inspired by the hit television show “American Ninja Warrior”, offers a wide variety of obstacle courses for kids of every age and skill level. Agility course, swingi...","https://assets.simpleviewinc.com/simpleview/image/upload/c_fit,w_225,h_225/crm/cnscvb/UltimateNinjasNorthShore_A00CDD27-5056-A348-3A8E31A300274A3F-a00cdcbe5056a34_a00cdd76-5056-a348-3ad6e61c807db45f.jpg",Chicago North shore,Shopping,inspired hit television show “ american ninja warrior offer wide variety obstacle course kid every age skill level agility course swingi
1. Great River Road,"Built along the Mighty Mississippi, at 550 miles long, the Great River Road runs almost the entire length of the state. With both northern and southern sections of the byway, this gorgeous river drive offers everything from outdoor adventure and quiet charm, to presidential and colonial history and some good old fashioned kitsch. There’s no better way to experience the life and industry of the Mississippi River.",https://www.enjoyillinois.com/assets/Images/Scenic-Drives-+-Roadside-Attractions/Road-Great-River-Road-Hartford-to-Grafton__FocusFillWyIwLjQ5IiwiMC4zNyIsMTgyNCwxMDAwXQ.jpeg,Enjoy Illinois,Scienic Byways,built along mighty mississippi mile long great river road run almost entire length state northern southern section byway gorgeous river drive offer everything outdoor adventure quiet charm presidential colonial history good old fashioned kitsch better way experience life industry mississippi river
2. Meeting of the Great Rivers Scenic Route,"Meeting of the Great Rivers is a breathtaking 33-mile section of the Great River Road, where the great Mississippi, Illinois and Missouri rivers come together. Extending fromPere Marquette State Parkto theLewis and Clark State Historic Site, traces of history can be seen all throughout the bluffs and river towns along the byway.",https://www.enjoyillinois.com/assets/Images/Scenic-Drives-+-Roadside-Attractions/Cars-on-GreatRiverRoad__FocusFillWyItMC4xNiIsIjAuMjAiLDE4MjQsMTAwMF0.jpeg,Enjoy Illinois,Scienic Byways,meeting great river breathtaking mile section great river road great mississippi illinois missouri river come together extending frompere marquette state parkto thelewis clark state historic site trace history seen throughout bluff river town along byway
3. Historic Route 66,"The mother of all roads, and the original road trip, Route 66 begins in Chicago, Illinois. A mission all on its own, check outour Route 66 trip guidefor even more juicy details about this offbeat stretch of American roadway. Classic Americana, roadside photo ops, history, dining and so much more awaits.",https://www.enjoyillinois.com/assets/Images/Scenic-Drives-+-Roadside-Attractions/Car-Route-66-Road__FocusFillWyIwLjAwIiwiMC4wMCIsMTgyNCwxMDAwXQ.jpeg,Enjoy Illinois,Scienic Byways,mother road original road trip route begin chicago illinois mission check outour route trip guidefor even juicy detail offbeat stretch american roadway classic americana roadside photo ops history dining much awaits
4. Illinois River Road,"Travel the rolling hills of central Illinois as you follow the path of the Illinois River. At 291 miles, the Illinois River Road offers incredible views and opportunities to stretch your legs at some of the best state parks in Illinois. The Byway unites more than 100 nature-based destinations throughout the Illinois River Valley, beginning in Ottawa and ending 150 miles south in Havana. Find the best spots for hunting, fishing, hiking, biking, canoeing, wetlands, gardens, birding and watching wildlife.",https://www.enjoyillinois.com/assets/Images/Scenic-Drives-+-Roadside-Attractions/Peoria-River-Bridge-Illinois-River-Road__FocusFillWyItMC4xNiIsIjAuMDQiLDE4MjQsMTAwMF0.jpg,Enjoy Illinois,Scienic Byways,travel rolling hill central illinois follow path illinois river mile illinois river road offer incredible view opportunity stretch leg best state park illinois byway unites nature based destination throughout illinois river valley beginning ottawa ending mile south havana find best spot hunting fishing hiking biking canoeing wetland garden birding watching wildlife
5. Lincoln Highway,"Drive clear across northern Illinois on the nation’s first successful coast-to-coast highway.From the Indiana border, west toward the mighty Mississippi, you will find an adventure filled with variety, rich in history and heritage.Enjoy 179 miles of rolling farmland and classic Midwest traditions, as you loop around to the Great River Road or follow the byway toward Chicago.",https://www.enjoyillinois.com/assets/Images/Scenic-Drives-+-Roadside-Attractions/Lincoln-Highway-Pavilion-Aurora__FocusFillWyIwLjAwIiwiMC4wMCIsMTgyNCwxMDAwXQ.jpg,Enjoy Illinois,Scienic Byways,drive clear across northern illinois nation first successful coast coast highway indiana border west toward mighty mississippi find adventure filled variety rich history heritage enjoy mile rolling farmland classic midwest tradition loop around great river road follow byway toward chicago
6. Ohio River Scenic Byway,Take the scenic route to some of Illinois' best outdoor adventures as you wind your way along country roads and through theShawnee National Foreston the Ohio River Scenic Byway. Travel the 188 miles around the southern tip of Illinois to experience some of the very best scenic views and outdoor destinations in the state.,https://www.enjoyillinois.com/assets/Images/Outdoor-Activities/Spring/Summer/Pine-Hills-Shawnee-National-Forest__FocusFillWyItMC4xMyIsIjAuMTEiLDE4MjQsMTAwMF0.jpeg,Enjoy Illinois,Scienic Byways,take scenic route illinois ' best outdoor adventure wind way along country road theshawnee national foreston ohio river scenic byway travel mile around southern tip illinois experience best scenic view outdoor destination state
7. Historic National Road,"America’s first highway,the Historic National Road, stretches 164 miles from Marshall to East St. Louis. The Historic National Highway played a pivotal role in uniting the country and promoting interstate commerce. Visit prehistoric cities, Victorian architecture and Midwest small town America along the way.",https://www.enjoyillinois.com/assets/Images/Scenic-Drives-+-Roadside-Attractions/Brooks-Catsup-Bottle-Collinsville__FocusFillWyIwLjMxIiwiLTAuNzYiLDE4MjQsMTAwMF0.jpeg,Enjoy Illinois,Scienic Byways,america first highway historic national road stretch mile marshall east st louis historic national highway played pivotal role uniting country promoting interstate commerce visit prehistoric city victorian architecture midwest small town america along way
St. Charles Historic Walking Tour,Come explore the History of St. Charles on a self-guided tour that takes you through the decades of St. Charles history with 27 locations. Grab a…,https://enjoyillinois.dottie.io/assets/Tourism-Operators/images/143__FocusFillWyIwLjAwIiwiMC4wMCIsMzg0LDQ2NF0.JPG,Enjoy Illinois,"History, Art & Culture Tours",come explore history st charles self guided tour take decade st charles history location grab a…
Effingham County Veteran's Memorial,The Effingham County Veteran's Memorial wall is dedicated to all the men and women who served from all five branches of the armed forces. The names…,https://enjoyillinois.dottie.io/assets/Tourism-Operators/images/VetwallHero__FocusFillWyIwLjAwIiwiMC4wMCIsMzg0LDQ2NF0.jpg,Enjoy Illinois,"History, Art & Culture Tours",effingham county veteran 's memorial wall dedicated men woman served five branch armed force names…
St. Charles Municipal Building,"The St. Charles Municipal Building was designed in 1940 by architects R. Harold Zook. Art deco was an inspiration for the Municipal Building, but the end…",https://enjoyillinois.dottie.io/assets/Tourism-Operators/images/StCharles-Scarecrow-Fest-River-Chris-Peak-Give-Credit-for-online-and-notice-if-in-Print-so-he-can-have-a-copy-2-1920x1081__FocusFillWyIwLjAwIiwiMC4wMCIsMzg0LDQ2NF0.jpg,Enjoy Illinois,"History, Art & Culture Tours",st charles municipal building designed architect r harold zook art deco inspiration municipal building end…
Old Main at Knox College,Nowhere on the Knox campus are the history and the ideals of the College so intertwined with the modern-day work of faculty and students as in…,https://enjoyillinois.dottie.io/assets/Tourism-Operators/images/KK-Lincoln-Douglas-Old-Main-1__FocusFillWyIwLjAwIiwiMC4wMCIsMzg0LDQ2NF0.jpg,Enjoy Illinois,"History, Art & Culture Tours",nowhere knox campus history ideal college intertwined modern day work faculty student in…
Paramount Theatre,"World-class entertainment—including dance, music, Broadway-caliber theatre, and children’s programming.",https://enjoyillinois.dottie.io/assets/Tourism-Operators/images/Paramount-Little-Mermaid-1__FocusFillWyIwLjAwIiwiMC4wMCIsMzg0LDQ2NF0.jpg,Enjoy Illinois,"History, Art & Culture Tours",world class entertainment including dance music broadway caliber theatre child programming
Champaign County History Museum,Come see various exhibits and artifacts that hold true to the history that is Champaign County.,https://enjoyillinois.dottie.io/assets/Tourism-Operators/images/Cattle-Bank-Cleaned-Version2__FocusFillWyIwLjAwIiwiMC4wMCIsMzg0LDQ2NF0.JPG,Enjoy Illinois,"History, Art & Culture Tours",come see various exhibit artifact hold true history champaign county
Lincoln & Civil War Legacy Trail,"Walk in the footsteps of Abraham and Mary Todd Lincoln, and Civil War soldiers from both North and South.",https://enjoyillinois.dottie.io/assets/Tourism-Operators/images/Lincoln-Civil-Way-Legacy-Trail__FocusFillWyIwLjAwIiwiMC4wMCIsMzg0LDQ2NF0.jpg,Enjoy Illinois,"History, Art & Culture Tours",walk footstep abraham mary todd lincoln civil war soldier north south
Timber Lake Playhouse,Timber Lake Playhouse is Illinois' oldest continuously-running professional summer stock theatre. They offer live theater productions May-Sept. Reservations required.,https://enjoyillinois.dottie.io/assets/Tourism-Operators/images/TLP-2__FocusFillWyIwLjAwIiwiMC4wMCIsMzg0LDQ2NF0.jpg,Enjoy Illinois,"History, Art & Culture Tours",timber lake playhouse illinois ' oldest continuously running professional summer stock theatre offer live theater production may sept reservation required
Bishop Hill State Historic Site,Bishop Hill State Historic Site is an open-air museum. Visit Utopia on the Prairie.,https://enjoyillinois.dottie.io/assets/Tourism-Operators/images/Bishop-Hill-Illinois__FocusFillWyIwLjAwIiwiMC4wMCIsMzg0LDQ2NF0.JPG,Enjoy Illinois,"History, Art & Culture Tours",bishop hill state historic site open air museum visit utopia prairie
The Trail of Tears,"The Trail of Tears through southern Illinois stretches nearly sixty miles long. Original route segments exist as State Highway 146, lesser traveled county roads, and abandoned…",https://enjoyillinois.dottie.io/assets/Tourism-Operators/images/Alt-Main-Camp-Ground-Church-1920x1081__FocusFillWyIwLjAwIiwiMC4wMCIsMzg0LDQ2NF0.jpg,Enjoy Illinois,"History, Art & Culture Tours",trail tear southern illinois stretch nearly sixty mile long original route segment exist state highway lesser traveled county road abandoned…
Historic Nauvoo Visitor's Center,"Begin your exploration of historic Nauvoo here! Gather information on the restored homes, shops, and religious buildings in Historic Nauvoo and register for guided tours to…",https://enjoyillinois.dottie.io/assets/Tourism-Operators/images/Historic-Nauvoo-Visitor-Center__FocusFillWyIwLjAwIiwiMC4wMCIsMzg0LDQ2NF0.jpg,Enjoy Illinois,"History, Art & Culture Tours",begin exploration historic nauvoo gather information restored home shop religious building historic nauvoo register guided tour to…
